[{"seq": 1, "ts": "2026-10-17T00:00:00Z", "actor": "SYSTEM", "role": "SYSTEM", "action": "GENESIS", "purpose": null, "case_ref": null, "summary": "Audit chain initialised.", "prev_hash": "0000000000000000000000000000000000000000000000000000000000000000", "hash": "a1b2c3d4e5f6a1b2c3d4e5f6a1b2c3d4e5f6a1b2c3d4e5f6a1b2c3d4e5f6a1b2"}, {"seq": 2, "ts": "2026-10-17T00:01:00Z", "actor": "analyst1", "role": "ANALYST", "action": "ENTITY_VIEW", "purpose": "INVESTIGATION", "case_ref": "CASE-SPO-000031", "summary": "Viewed entity P-000045.", "prev_hash": "a1b2c3d4e5f6a1b2c3d4e5f6a1b2c3d4e5f6a1b2c3d4e5f6a1b2c3d4e5f6a1b2", "hash": "b2c3d4e5f6a1b2c3d4e5f6a1b2c3d4e5f6a1b2c3d4e5f6a1b2c3d4e5f6a1b2c3"}]
